{
    "srcFolder": "src",
    "defaultExt": "ts",
    "additionalTypes": [
        {
            "name": "test",
            "plural": "tests"
        }
    ],
    "customFileTemplates": [
        {
            "itemName": "dto",
            "template": "export class #classname# {\n\n}\n"
        },
        {
            "itemName": "test",
            "template": "export class #classname# {\n\n}\n"
        }
    ],
    "dotnetInterfaceStyle": false
}